{
  "task": "postmortem",
  "decision": "publish",
  "summary": "该条内容在24小时窗口内表现优于近期基线，说明“小户型厨房收纳+低成本步骤”方向值得继续放大。",
  "risk_alerts": [
    "若连续重复同一厨房切口，后续可能出现审美疲劳",
    "评论中对“更便宜替代方案”的需求应在下一条中响应"
  ],
  "scores": {
    "topic_potential": 0.83,
    "fit_account": 0.87,
    "novelty": 0.58,
    "risk": 0.27,
    "confidence": 0.82
  },
  "why": [
    "收藏显著高于评论，说明内容对实用型受众有较强保存价值",
    "评论反馈集中在可执行细节，说明正文结构清晰且需求真实",
    "标题中的“显大+3个细节”兼顾结果感与清单感"
  ],
  "next_actions": [
    "继续做同系列，但切换到“更省钱替代方案”角度",
    "保持前后对比首图与步骤结构",
    "下一条增加预算区间说明，提升转化感"
  ],
  "task_specific_payload": {
    "keep_factors": [
      "结果导向标题",
      "三步清单结构",
      "前后对比首图"
    ],
    "drop_factors": [
      "连续多条只讲厨房台面",
      "过度复刻同一标题模板"
    ],
    "next_test_directions": [
      "出租屋厨房收纳的平替好物清单",
      "同预算下不同收纳方案对比"
    ]
  }
}
