{
  "task": "generate_post_plan",
  "decision": "publish",
  "summary": "建议继续围绕小户型厨房收纳做一条更强调前后反差与清单感的图文内容。",
  "risk_alerts": [
    "避免承诺绝对效果，如“看起来大一倍”",
    "避免标题过度夸张"
  ],
  "scores": {
    "topic_potential": 0.85,
    "fit_account": 0.88,
    "novelty": 0.74,
    "risk": 0.22,
    "execution_complexity": 0.31,
    "confidence": 0.84
  },
  "why": [
    "账号定位与 observed posts 样本高度一致",
    "近期内容已验证收纳方向有收藏潜力",
    "赛道样本显示“显大+低成本+步骤清单”组合更易触发点击与收藏"
  ],
  "next_actions": [
    "按“三步整理+前后对比”结构起草正文",
    "封面优先突出改造前后差异",
    "标题加入“小户型/出租屋/低成本”中的两个关键词"
  ],
  "task_specific_payload": {
    "recommended_topic": "小户型厨房台面显大改造",
    "angle": "用3个低成本收纳动作做出台面清爽前后对比",
    "title_candidates": [
      "出租屋厨房显大，先改这3个收纳细节",
      "小户型厨房别乱买，这3步收纳最见效"
    ],
    "cover_direction": [
      "左侧杂乱右侧清爽的前后对比首图",
      "封面加上“3个细节”数字提示"
    ],
    "body_structure": [
      "先展示改造前痛点",
      "逐条拆解3个动作及成本",
      "总结适合人群与避坑点"
    ],
    "tags": [
      "#小户型收纳",
      "#厨房改造",
      "#出租屋布置"
    ],
    "publish_window": "19:00-22:00"
  }
}
